pubmed_id,title,publication_date,non_academic_authors,company_affiliations,corresponding_author_email
40747112,Evaluating polygenic risk score prediction performance for Alzheimer's disease in a population-based Hispanic cohort using single- and multi-ancestry models.,2025-Sep-None,Yahaira Franco; Martin Medrano,"Clinica Corominas, Santiago, Dominican Republic.; Pontificia Universidad Catolica Madre y Maestra (PUCMM), Santiago, Dominican Republic.",
40746940,Dose escalation study of the HLA-A2-WT1 CD3 bispecific antibody RO7283420 in relapsed/refractory acute myeloid leukemia.,2025-Aug-None,Koorosh Korfi; Karen Yee; Anne Catherine Bretz; Jan Attig; Min Sun; Sina Nassiri; Tobias Rutishauser; Christian Klein; Y May Ma; Gabriel Schnetzler; Stephanie Vauleon; Huixin Yu; Muriel Richard; Silke Simon; Heather Hinton; Nino Keshelava,"Cancer Clinical Research Unit, Princess Margaret Cancer Centre, Toronto, ON, Canada.; Product Development Safety, F. Hoffmann-La Roche Ltd, Basel, Switzerland.; Roche Pharma Research and Early Development, Oncology, Roche Innovation Center Munich, Penzberg, Germany.; Roche Pharma Research and Early Development, Oncology, Roche Innovation Center Zurich, Schlieren, Switzerland.; Roche Pharma Research and Early Development, Oncology, Roche Innovation Center, Basel, Switzerland.; Roche Pharma Research and Early Development, Pharmaceutical Sciences, Roche Innovation Center, Basel, Switzerland.",
40746669,"Real-World Validity of Tissue-Agnostic Circulating Tumor DNA Response Monitoring in Lung Cancers Treated With Chemotherapy, Immunotherapy, or Targeted Agents.",2025-Sep-None,Zoe June Assaf; Yi Cao; Vladan Antic; David Shames; Sophia Maund; Alexia Exarchos; Katja Schulze,"F. Hoffmann-La Roche Ltd., Basel, Switzerland.; Genentech, Inc., South San Francisco, California.",
40745610,Targeting high circulating dipeptidyl peptidase 3 in circulatory failure.,2025-Jul-31,Karine Santos,"4TEEN4 Pharmaceuticals GmbH, Hennigsdorf, Germany.",adrien.picod@gmail.com
40745097,The implementation of frailty assessment in gynecologic oncology: an international multicenter JAGO-NOGGO survey.,2025-Jul-31,C Flethe; C Krause; A von Beckerath; S Alavi-Demirci; M Beck; K Pietzner; J Sehouli,"Young Academy of Gynecologic Oncology (JAGO), North-Eastern German Society of Gynecologic Oncology (NOGGO), Berlin, Germany.; Young Academy of Gynecologic Oncology (JAGO), North-Eastern German Society of Gynecologic Oncology (NOGGO), Berlin, Germany. Chiara.flethe@charite.de.",Chiara.flethe@charite.de
